"Status","Start Time","Stop Time","Duration in ms","Parent Suite","Suite","Sub Suite","Test Class","Test Method","Name","Description"
"passed","Sun Aug 25 10:43:16 GMT 2024","Sun Aug 25 10:43:17 GMT 2024","281","tests","account_test","TestAccount","","","Information about the user and books in his profile",""
"passed","Sun Aug 25 10:43:15 GMT 2024","Sun Aug 25 10:43:15 GMT 2024","296","tests","account_test","TestAccount","","","User authorization status",""
"passed","Sun Aug 25 10:43:20 GMT 2024","Sun Aug 25 10:43:22 GMT 2024","2142","tests","book_store_test","TestBookStore","","","Added books in the user profile",""
"passed","Sun Aug 25 10:43:33 GMT 2024","Sun Aug 25 10:43:33 GMT 2024","473","tests","book_store_test","TestBookStore","","","Checking if the book information from the get request matches the books in the list",""
"passed","Sun Aug 25 10:43:28 GMT 2024","Sun Aug 25 10:43:31 GMT 2024","3352","tests","book_store_test","TestBookStore","","","Delete book in the user profile",""
"skipped","Sun Aug 25 10:43:33 GMT 2024","Sun Aug 25 10:43:33 GMT 2024","0","tests","book_store_test","TestBookStore","","","Replacing a book from the profile by a new book request ",""
"passed","Sun Aug 25 10:43:18 GMT 2024","Sun Aug 25 10:43:19 GMT 2024","780","tests","book_store_test","TestBookStore","","","Added book in the user profile",""
"passed","Sun Aug 25 10:43:23 GMT 2024","Sun Aug 25 10:43:27 GMT 2024","3466","tests","book_store_test","TestBookStore","","","Delete all books in the user profile",""
